{
  "core_thesis": "Mechanism-indexed diagnostics improve robustness understanding.",
  "main_experiment_tests_thesis": true,
  "metrics_support_claims": true,
  "benchmark_not_toy": true,
  "baseline_is_strong_enough": false,
  "failure_modes_are_diagnostic": true,
  "ablations_are_diagnostic": true,
  "negative_result_still_useful": true,
  "construct_validity_risks": [
    "Current baseline set lacks strongest protocol baselines"
  ],
  "required_plan_revisions": [
    "Add two strong protocol baselines",
    "Expand stress setting coverage"
  ]
}
